{"describedBy": "https://schema.humancellatlas.org/type/protocol/sequencing/6.2.0/library_preparation_protocol", "schema_type": "protocol", "protocol_core": {"protocol_id": "LibraryPrepProtocol2", "protocol_name": "LibraryPrepProt1", "protocol_description": "LibraryPrepProt Test", "publication_doi": "19.1191/293245", "protocols_io_doi": "10.17504/protocols.io.mgjc3un", "document": "my_cool_protocol.pdf"}, "cell_barcode": {"barcode_read": "Read 2", "barcode_offset": 0, "barcode_length": 28, "white_list_file": "barcode_whitelist_file.txt"}, "input_nucleic_acid_molecule": {"text": "polyA RNA", "ontology": "OBI:0000869", "ontology_label": "polyA RNA"}, "nucleic_acid_source": "bulk cell", "library_construction_method": {"text": "10X v2 sequencing", "ontology": "EFO:0009310", "ontology_label": "10X v2 sequencing"}, "library_construction_kit": {"retail_name": "SureCell", "catalog_number": "20014279", "manufacturer": "Illumina", "lot_number": "10001A", "expiry_date": "2018-01-31", "kit_titer": "3.0x10^7"}, "nucleic_acid_conversion_kit": {"retail_name": "SureCell WTA 3' Library Prep Kit", "catalog_number": "20014279", "manufacturer": "Illumina", "lot_number": "10001A", "expiry_date": "2018-01-31", "kit_titer": "3.0x10^7"}, "end_bias": "3 prime end bias", "primer": "random", "strand": "second", "spike_in_kit": {"retail_name": "SureCell WTA 3' Library Prep Kit", "catalog_number": "20014279", "manufacturer": "Illumina", "lot_number": "10001A", "expiry_date": "2018-01-31", "kit_titer": "3.0x10^7"}, "spike_in_dilution": 100, "umi_barcode": {"barcode_read": "Read 2", "barcode_offset": 0, "barcode_length": 28, "white_list_file": "barcode_whitelist_file.txt"}, "library_preamplification_method": {"text": "PCR", "ontology": "OBI:0000552", "ontology_label": "reverse transcription PCR"}, "cdna_library_amplification_method": {"text": "PCR", "ontology": "OBI:0000552", "ontology_label": "reverse transcription PCR"}, "nominal_length": 250, "nominal_sdev": 30, "provenance": {"document_id": "2cc9c89a-e498-4249-b4d0-277efa5fcd65", "submission_date": "2021-03-16T16:15:23.709Z", "update_date": "2021-03-16T16:15:47.860Z", "schema_major_version": 6, "schema_minor_version": 2}}